{
  "record_id": "or_0002",
  "work_unit": "wu_7f3c",
  "tenant_chain": [
    "platform",
    "builder_12",
    "customer_88"
  ],
  "contract_version": "c-2026-10-v3",
  "decider_bundle": "sha256:814ce280decc7f0467a7c1353d58edb8862cd40b6e9f9ad4878b34dd4dcf9f13",
  "evidence": [
    "sha256:a92779298cb24f676461b00b11d8491c672960bdc8028a15ed1337aca6fb7fbd",
    "sha256:400c7bb0dcd0d3bf1181a59c004b2e84fe9cc3f405db37648d64af4fae65ca7e"
  ],
  "input_snapshot": "sha256:062a76bf1961265eb063aedff4ad03b6aeafb3970fef690f082dc484f9069ae7",
  "state": "final",
  "outcome": {
    "level": "not_fulfilled",
    "goals_met": 0.0,
    "constraints_ok": true,
    "integrity_ok": true
  },
  "decided_by": "tier_0",
  "reason": "late evidence: change reverted on day 9; supersedes provisional fulfilled record",
  "occurred_at": "2026-10-11T08:42:00Z",
  "recorded_at": "2026-10-11T08:42:03Z",
  "supersedes": "or_0001",
  "prev_hash": "sha256:a967eb5ce8c196c7e98729b15624381bdd95e3766b752e2bdf8b25f5bced0dd9"
}
